### ISSUE TITLE
now working with my Xbox One S

### ISSUE THREAD

**Issue by mrmrmrmr1** [unknownskl/xbox-smartglass-core-node#7]
I've installed it on my PI3 setup however, it does not wake up my Xbox One S.
I set my live ID and IP address correctly
When I call the power_on function I see 3 arp messages sent out from the PI3 to the IP address I've set.
However, there's nothing else:
14:33:33.780660 ARP, Request who-has 192.168.254.37 tell 192.168.254.199, length 28
14:33:34.796301 ARP, Request who-has 192.168.254.37 tell 192.168.254.199, length 28
14:33:35.836292 ARP, Request who-has 192.168.254.37 tell 192.168.254.199, length 28
What is wrong ?

**Comment by unknownskl** [comment]
Can you try to do it multiple requests? Its a bit unstable at the moment as far I know. (Going to improve it in the future once the authentication is working)

**Comment by mrmrmrmr1** [comment]
tried about 10 times just now. none of them worked.
Actually it only worked once when I installed first time.
is there any way to troubleshoot/analyze ?

**Comment by unknownskl** [comment]
Are you sure that you provided the correct ip address and live id? For now both are required.

**Comment by mrmrmrmr1** [comment]
yes. both are supplied correctly.  how can we troubleshoot ? 
I can take network traces.

**Comment by mrmrmrmr1** [comment]
I tried several times but now it's not really working. not even once.
which client can I compare with ?
is there an official smartglass client ?

**Comment by mrmrmrmr1** [comment]
oh I checked now it is a client for windows 10 mobile.
I don't have any...

**Comment by foxriver76** [comment]
On iOS and Android it is integrated in the Xbox app meanwhile (in the paar ist was a separate app called smart glass). It also works very bad. I read once that ist will only work properly when the Xbox is connected via ethernet cable instead of wirless.
